Product,Code,Price
Телескопичен водач с пълно изтегляне FGV - 45мм,Код: 010587,5.70лв.
Телескопичен водач с плавно прибиране FGV - 45мм,Код: 010678,12.39лв.
Телескопичен водач с плавно прибиране 36 мм,Код: 010733,7.06лв.
Телескопичен водач с пълно изтегляне 35мм,Код: 010707,2.62лв.
Телескопични водачи 27мм 2/3 изтегляне,Код: 010786,1.21лв.
Телескопичен водач 17мм,Код: 010651,3.15лв.
Телескопичен водач с пълно изтегляне D'CONTI -45 мм,Код: 010959,5.20лв.
Телескопичен водач с плавно прибиране D'CONTI -45 мм,Код: 010968,8.00лв.
